{
  "$schema": "https://json-schema.org/draft/2020-12/schema",
  "$id": "https://raw.githubusercontent.com/judegordon/hgps/main/schemas/config/config.json",
  "type": "object",
  "description": "Root configuration for a HealthGPS simulation.",
  "properties": {
    "$schema": {
      "type": "string"
    },
    "project_requirements": {
      "$ref": "project_requirements.json"
    },
    "data": {
      "$ref": "data.json"
    },
    "inputs": {
      "$ref": "inputs.json"
    },
    "modelling": {
      "$ref": "modelling.json"
    },
    "running": {
      "$ref": "running.json"
    },
    "output": {
      "$ref": "output.json"
    },
    "population_impact_fraction": {
      "$ref": "population_impact_fraction.json"
    }
  },
  "required": [
    "project_requirements",
    "data",
    "inputs",
    "modelling",
    "running",
    "output"
  ],
  "additionalProperties": false
}